{
  "$schema": "https://blackboxes.engine/schema/v1.json",
  "version": "1.0.0",
  "meta": {
    "brand": "Blackboxes",
    "app": "Box'em",
    "title": "Biomedical & MedTech Clinical Constraint Matrix",
    "occupation": "custom",
    "preset": "Clinical Systems Matrix",
    "author": "Blackboxes Clinical Core"
  },
  "constraints": {
    "timeWeeks": 8.0,
    "costBudget": 22000,
    "qualityPercent": 98,
    "scopePercent": 100,
    "lockMode": "cost",
    "baseRate": 210
  },
  "submodules": [
    { "id": "mod_1", "name": "Analog Biosensor Signal Conditioning", "reqQuality": 60 },
    { "id": "mod_2", "name": "ISO 13485 Fault-Tolerant Firmware", "reqQuality": 80 },
    { "id": "mod_3", "name": "Encrypted Telemetry & HIPAA Gateway", "reqQuality": 90 },
    { "id": "mod_4", "name": "FDA Clinical Validation Dossier", "reqQuality": 98 }
  ],
  "visuals": {
    "shaderPreset": "emerald",
    "fontScale": 1.3,
    "theme": "dark",
    "customNodeModels": {}
  }
}
