{
  "$schema": "https://blackboxes.engine/schema/v1.json",
  "version": "1.0.0",
  "meta": {
    "brand": "Blackboxes",
    "app": "Box'em",
    "title": "High-Fidelity Software Core",
    "occupation": "software",
    "preset": "Agency High Craft",
    "author": "Blackboxes Engineering Core"
  },
  "constraints": {
    "timeWeeks": 3.0,
    "costBudget": 5500,
    "qualityPercent": 85,
    "scopePercent": 100,
    "lockMode": "time",
    "baseRate": 95
  },
  "submodules": [
    { "id": "mod_1", "name": "Core Business Logic & API", "reqQuality": 20 },
    { "id": "mod_2", "name": "Responsive UI/UX Frontend", "reqQuality": 45 },
    { "id": "mod_3", "name": "Automated QA & Unit Tests", "reqQuality": 75 },
    { "id": "mod_4", "name": "High-Availability CI/CD & Scale", "reqQuality": 90 }
  ],
  "visuals": {
    "shaderPreset": "classic",
    "fontScale": 1.3,
    "theme": "dark",
    "customNodeModels": {}
  }
}
