{
  "$schema": "https://blackboxes.engine/schema/v1.json",
  "version": "1.0.0",
  "meta": {
    "brand": "Blackboxes",
    "app": "Box'em",
    "title": "Rapid Barebones MVP",
    "occupation": "software",
    "preset": "Draft Prototype",
    "author": "Blackboxes Rapid Lab"
  },
  "constraints": {
    "timeWeeks": 1.5,
    "costBudget": 2200,
    "qualityPercent": 55,
    "scopePercent": 25,
    "lockMode": "time",
    "baseRate": 95
  },
  "submodules": [
    { "id": "mod_1", "name": "Core Business Logic & API", "reqQuality": 20 }
  ],
  "visuals": {
    "shaderPreset": "liquid",
    "fontScale": 1.3,
    "theme": "dark",
    "customNodeModels": {}
  }
}
